{
  "eventId": "44444444-4444-4444-8444-444444444444",
  "eventType": "DocumentVersionSaved",
  "schemaVersion": 1,
  "occurredAt": "2026-10-04T00:00:00Z",
  "producer": "document-service",
  "traceId": "11111111111111111111111111111111",
  "payload": {
    "documentId": "11111111-1111-4111-8111-111111111111",
    "versionId": "22222222-2222-4222-8222-222222222222",
    "revision": 1,
    "ownerUserId": "33333333-3333-4333-8333-333333333333",
    "actorUserId": "33333333-3333-4333-8333-333333333333",
    "objectRef": {
      "provider": "GCS",
      "bucket": "YOUR_PRIVATE_SNAPSHOTS_BUCKET",
      "key": "snapshots/11111111-1111-4111-8111-111111111111/22222222-2222-4222-8222-222222222222.tedoc",
      "generation": "123456789"
    },
    "nativeSha256": "aaaaaaaaaaaaaaaaaaaaaaaaaaaaaaaaaaaaaaaaaaaaaaaaaaaaaaaaaaaaaaaa",
    "nativeBytes": 1024,
    "textUtf8Bytes": 11,
    "utf16Length": 11,
    "logicalLines": 1
  }
}
